{
  "$schema": "https://json-schema.org/draft/2020-12/schema",
  "$id": "https://masterpiece-os.local/spatial-reality-dna.schema.v9b.1.json",
  "title": "Spatial Reality DNA v9B.1",
  "description": "Masterpiece OS Space Generator Phase 9B.1 Spatial Reality Calibration Input. v9B.1 是 Phase 9B Spatial Intent Reasoning 的 Reality Constraint layer, 输入 spatialRealityDna (8 字段) 编译为 spatial_reality_constraint block, 防止 Spatial Intent 增强后模型偏向 exhibition/installation/concept architecture, 提升商业真实性. 不调真实 Provider, 不修改 Prompt Runtime (Phase 9B.1 §8 验收). 冻结 Spatial Intent / Architecture Anchor / architecture_context (Phase 9B.1 §8).",
  "type": "object",
  "required": [
    "schemaRef",
    "brandKey",
    "category",
    "phase",
    "spatialRealityDna"
  ],
  "additionalProperties": false,
  "properties": {
    "schemaRef": {
      "type": "string",
      "description": "固定 https://masterpiece-os.local/spatial-reality-dna.schema.v9b.1.json"
    },
    "brandKey": {
      "type": "string",
      "description": "品牌标识, e.g. 'jiuzhou-aesthetics' | 'feng-tang-tang' | 'yi-ji-liang-fang'"
    },
    "category": {
      "type": "string",
      "description": "行业类型, e.g. 'medical_aesthetics' | 'restaurant' | 'health_management'"
    },
    "phase": {
      "type": "string",
      "const": "9B.1"
    },
    "spatialRealityDna": {
      "type": "object",
      "required": [
        "spaceType",
        "commercialScale",
        "requiredZones",
        "operationLogic",
        "userFlow",
        "privacyRequirement",
        "materialReality",
        "forbiddenSpatialTypes"
      ],
      "additionalProperties": false,
      "properties": {
        "spaceType": {
          "type": "string",
          "description": "Phase 9B.1 §3 字段 1: 空间类型 (e.g. 'medical_aesthetics_clinic' / 'casual_restaurant' / 'tcm_wellness_clinic')"
        },
        "commercialScale": {
          "type": "string",
          "description": "Phase 9B.1 §3 字段 2: 商业规模 (e.g. '200 sqm flagship clinic' / '80-150 sqm casual dining')"
        },
        "requiredZones": {
          "type": "array",
          "minItems": 1,
          "items": { "type": "string" },
          "description": "Phase 9B.1 §3 字段 3: 必备功能区 (e.g. ['reception', 'waiting', 'consultation', 'treatment'])"
        },
        "operationLogic": {
          "type": "string",
          "description": "Phase 9B.1 §3 字段 4: 运营逻辑 (e.g. 'patient flow + VIP appointment' / 'visible food prep + social dining')"
        },
        "userFlow": {
          "type": "string",
          "description": "Phase 9B.1 §3 字段 5: 用户动线 (e.g. 'street -> reception -> waiting -> consultation -> treatment')"
        },
        "privacyRequirement": {
          "type": "string",
          "description": "Phase 9B.1 §3 字段 6: 隐私要求 (e.g. 'open public + filtered semi-private + enclosed treatment')"
        },
        "materialReality": {
          "type": "string",
          "description": "Phase 9B.1 §3 字段 7: 材料现实 (e.g. 'real medical-grade materials: mineral_plaster, frosted_glass, brushed metal')"
        },
        "forbiddenSpatialTypes": {
          "type": "array",
          "minItems": 1,
          "items": { "type": "string" },
          "description": "Phase 9B.1 §3 字段 8: 反漂移 (e.g. ['hospital corridor', 'art gallery', 'nightclub', 'exhibition hall'])"
        }
      }
    },
    "metadata": {
      "type": "object",
      "description": "frozen metadata: frozenAt / frozenBy / sourceArchitectureAnchors / notes"
    }
  },
  "phase": "9B.1",
  "frozen_at": "2026-08-01",
  "frozen_by": "Space Generator v1.1 Phase 9B.1 Spatial Reality Calibration",
  "layerBoundaryRules": {
    "SpatialIntentLayer_answer": "为什么需要这样的空间体验",
    "ArchitectureBridgeLayer_answer": "什么建筑原则支持这种体验",
    "SpatialRealityLayer_answer": "什么商业现实约束这个空间",
    "SpatialReality_CAN": [
      "specify 8 fields (spaceType / commercialScale / requiredZones / operationLogic / userFlow / privacyRequirement / materialReality / forbiddenSpatialTypes)",
      "constrain 商业真实性, 防止模型偏向 exhibition / installation / concept architecture",
      "提供 必备功能区 + 用户动线 + 反漂移 forbidden spatial types"
    ],
    "SpatialReality_CANNOT": [
      "select specific architecture anchor (e.g. JZMX-ARCH-01)",
      "describe specific decoration elements (e.g. 花瓣 / 羽翼)",
      "copy specific reference image (e.g. 特定空间图片元素)",
      "generate prompt (由 prompt-compiler 负责)",
      "modify Spatial Intent / Architecture Anchor / architecture_context (Phase 9B.1 §8 冻结)"
    ]
  }
}
