{
  "schemaRef": "https://masterpiece-os.local/spatial-reality-dna.schema.v9b.1.json",
  "brandKey": "jiuzhou-aesthetics",
  "category": "medical_aesthetics",
  "phase": "9B.1",
  "spatialRealityDna": {
    "spaceType": "medical_aesthetics_clinic",
    "commercialScale": "200 sqm flagship street_store clinic, single tenant",
    "requiredZones": [
      "reception_desk",
      "waiting_area",
      "brand_wall",
      "consultation_room",
      "consultation_guidance",
      "vip_lounge"
    ],
    "operationLogic": "patient flow + VIP appointment system; staff 在前台 / 咨询室 / 治疗室轮转, 必须随时可见",
    "userFlow": "street -> reception -> waiting -> consultation -> treatment -> checkout, 同一用户 90-120 分钟内完成, 路径上 staff 3-5 人可见",
    "privacyRequirement": "open public zone (reception/waiting) + filtered semi-private (consultation_guidance) + enclosed treatment, 不可出现 hospital corridor 风格硬门硬隔",
    "materialReality": "real medical-grade materials: mineral_plaster, frosted_glass, brushed metal, fine_textured_stone, matte_white_surface, 4-5 类内, 不可出现花岗岩 / 大理石 / 亚克力发光",
    "forbiddenSpatialTypes": [
      "hospital corridor (硬墙 + 顶灯 + 排椅)",
      "art gallery (空墙 + 射灯 + 单件艺术品)",
      "modern museum (白盒 + 离散雕塑)",
      "nightclub lighting (深色 + 紫红 + 镭射)",
      "exhibition hall (中心展示台 + 巡游动线)",
      "art installation (装饰性雕塑 / 装置为主)",
      "spa retreat (无 staff / 纯冥想空间)",
      "fine art gallery (无 staff 纯展示)"
    ]
  },
  "metadata": {
    "frozenAt": "2026-08-01",
    "frozenBy": "Space Generator v1.1 Phase 9B.1 Spatial Reality Calibration",
    "sourceArchitectureAnchors": ["JZMX-ARCH-01-ReceptionMembrane", "JZMX-ARCH-02-EntranceGlass", "JZMX-ARCH-03-ConsultationFacade"],
    "notes": "Phase 9B.1 §3 8 字段. spaceType 跟 industry 区分, commercialScale 量化 200 sqm + flagship 决定 staff 密度. forbiddenSpatialTypes 重点排 hospital corridor / art gallery / exhibition hall, 因为 Phase 9B Mode B 在这几个方向上 drift 风险最高."
  }
}
